Business name,Capabilities narrative,Capabilities statement link,Active SBA certifications,Contact person's name,Contact person's email,Address line 1,Address line 2,City,State,Zipcode,Primary NAICS code,All NAICS codes,“Small” NAICS codes
"=HYPERLINK( ""https://search.certifications.sba.gov/profile/VK22MYTTHZH3/3UDE4"", ""WARM SPRINGS CONSTRUCTION ENTERPRISE"" )","Roads/Highway Construction, Repair, and Maintenance, Flagging, Heavy Equipment Operators, Custom Tile, Wall Tile, Floor Tile, Quick Set Cement, Fast Set Cement, Concrete, Payroll Software, Human Resources Software, Records Storage, Industrial Park",,8(a),JAMES SOUERS,JIM.SOUERS@WSTRIBES.ORG,4202 HOLLIDAY ST,,WARM SPRINGS,Oregon,97761,237310,"212321, 236115, 236118, 236220, 237110, 237210, 237310, 237990, 238110, 238120, 238130, 238190, 238320, 238350, 238910","212321, 236115, 236118, 236220, 237110, 237210, 237310, 237990, 238110, 238120, 238130, 238190, 238320, 238350, 238910"
"=HYPERLINK( ""https://search.certifications.sba.gov/profile/DXCYR1JGELG1/465S1"", ""GRIFFITH CONTRACTING, LLC"" )","Griffith Contracting is a veteran-owned and woman-owned small business, our 8a certification and Hubzone status make us an ideal choice for the Federal Government. Built with 30 years experience and proven past performance of 60 completed federal contracts. Valued in excess of $26 million in Industrial, Military, Health and Government sectors.",http://www.griffithcontracting.com/uploads/2/6/8/8/26888696/griffith_contracting_-_capability_statement_may2024,"8(a), HUBZone, WOSB, EDWOSB",LEANN GRIFFITH,leann@griffithcontracting.com,29400 E 68TH ST S,,BROKEN ARROW,Oklahoma,74014,236220,"236220, 237310, 237990, 238160, 238210, 238220, 238320, 238330, 238910, 238990, 561730","236220, 237310, 237990, 238160, 238210, 238220, 238320, 238330, 238910, 238990, 561730"
"=HYPERLINK( ""https://search.certifications.sba.gov/profile/K6N8ZTZ3L5M5/845X9"", ""KAIA INC"" )","KAIA Inc. delivers mission-ready visualization that supports faster decisions, improves operator performance, and reduces uncertainty. We serve programs across defense, aerospace, and energy by transforming complex technical systems into intuitive visuals—digital twins, interactive walkthroughs, user interfaces, and mission-aligned tools. Our Emmy-winning team has over 30 years of experience supporting federal clients including FAA, DHS, and BLM. We help agencies communicate with clarity, streamline operations, and minimize risk through targeted visual assets. From stakeholder briefings to engineering support, KAIA builds tools that increase comprehension before systems go live. Our visuals accelerate onboarding, reduce delays, and support high-performance execution. KAIA combines operational insight with design expertise to deliver clear, actionable media that aligns with mission needs and enhances overall readiness.",http://tinyurl.com/KAIAcapabilityStatement,8(a),JONATHAN LEVY,jon.levy@kaiainc.com,3015 NE 98TH CI,,VANCOUVER,Washington,98665,541519,"512110, 512120, 512191, 513199, 516210, 541330, 541410, 541430, 541490, 541511, 541512, 541513, 541519, 541611, 541613, 541618, 541713, 541714, 541715, 541720, 541810, 541820, 541840, 541910, 541922, 541990, 561410, 611420, 611430, 611512, 611710","512110, 512120, 512191, 513199, 516210, 541330, 541410, 541430, 541490, 541511, 541512, 541513, 541519, 541611, 541613, 541618, 541713, 541714, 541715, 541720, 541810, 541820, 541840, 541910, 541922, 541990, 561410, 611420, 611430, 611512, 611710"
"=HYPERLINK( ""https://search.certifications.sba.gov/profile/VAYNGUJDQ2R1/85KL4"", ""MICRON AIR & MECHANICAL SOLUTIONS INC"" )",,,8(a),KEVIN BUENO,kbueno@micronams.com,3553 BLACKWELL PL,,LEXINGTON,Kentucky,40509,238220,"236115, 236116, 236210, 236220, 237990, 238220, 238290, 541990, 811310","236115, 236116, 236210, 236220, 237990, 238220, 238290, 541990, 811310"
"=HYPERLINK( ""https://search.certifications.sba.gov/profile/S443VJC4SG95/9MF16"", ""BERING-WESTON JV, LLC"" )","Bering-Weston is a Joint Venture between Bering Straits Global Innovations, LLC (BSGI), an 8(a) certified company, and Weston Solutions, Inc. (Weston), a full-service engineering and construction firm. Our partnership builds upon multiple projects performed together under prime/sub relationships and long-term, legacy working relationships between a number of our key personnel, and decades of experience working with the Department of Defense (DoD) supporting military and civil construction programs and environmental restoration programs. For 25+ years, Weston has been providing clients with unparalleled support of all phases of design-build contracts, attending pre-construction conferences, reviewing contractor submittals/RFIs, providing QA/QC reviews of contractor submittals, and preparing value engineering proposals. Since 2015 Weston has been awarded 2,400+ projects valued at over $2.5B dollars of engineering and construction services to government and commercial industry clients.",,8(a) JV,RICHARD KERR,rkerr@bsnc.net,3301 C ST STE 400,,ANCHORAGE,Alaska,99503,236210,"221310, 236115, 236116, 236210, 236220, 237110, 237120, 237130, 237990, 238190, 238320, 238910, 238990, 492110, 522390, 541330, 541614, 562211, 562910, 562998, 811111","221310, 236115, 236116, 236210, 236220, 237110, 237120, 237130, 237990, 238190, 238320, 238910, 238990, 492110, 522390, 541330, 541614, 562211, 562910, 562998, 811111"
"=HYPERLINK( ""https://search.certifications.sba.gov/profile/TX2SS15JMHD3/8TD64"", ""YULISTA SERVICES, LLC"" )",,,8(a),LATOSHA GORDON,latosha.gordon@yulista.com,120 BOLLING RD,,MERIDIANVILLE,Alabama,35759,336413,336413,336413
"=HYPERLINK( ""https://search.certifications.sba.gov/profile/KJFPJM86BPS4/7YR71"", ""SEALASKA REMEDIATION SOLUTIONS, LLC"" )","Sealaska Remediation Solutions was 8(a) certified on February 7, 2019. We are a full service environmental consultant that specializes in environmental site assessment; environmental planning, permitting and reporting; regulatory compliance; remedial investigation; environmental engineering and remediation system design; groundwater, soil, surface water and sediment remediation; in situ groundwater investigation and remediation; remediation system operation, maintenance and optimization; and long-term monitoring and remedy assessment.",,8(a),DAVID KOSTOROWSKI,david.kostorowski.2@sealaska.com,1200 6TH AVE STE 800,,SEATTLE,Washington,98101,562910,"237990, 541330, 541620, 541990, 561990, 562211, 562910, 562998","237990, 541330, 541620, 541990, 561990, 562211, 562910, 562998"
"=HYPERLINK( ""https://search.certifications.sba.gov/profile/CSN3LHCMNX48/79MG3"", ""ALEUT OPERATIONS, LLC"" )","Aleut Operations, LLC, provides professional business and program management services including project management, technology support services, and program support services. Aleut Operations can deliver, integrate, facilitate and maintain government and commercial operations and processes.",,8(a),CLINT BENFIELD,darrel.benfield@aleutfederal.com,2550 DENALI ST STE 1050,,ANCHORAGE,Alaska,99503,541611,"236220, 532289, 532420, 532490, 541611, 541614, 541618, 541690, 561210, 561720, 561730, 611519","236220, 532420, 532490, 541611, 561210, 611519"
"=HYPERLINK( ""https://search.certifications.sba.gov/profile/QUAWKRJT6DC5/9WGW9"", ""CCI CONSTRUCTION AND UTILITY SERVICES, LLC"" )",,,8(a),JOHN MORRISON,dmorrison@bbch-llc.com,29 BOWDOIN ST STE 115,,MANCHESTER,Maine,04351,237110,237110,237110
"=HYPERLINK( ""https://search.certifications.sba.gov/profile/TGGAL8H2TRQ4/8WD37"", ""ISLAND EMPIRE TECHNOLOGY SYSTEMS LLC"" )","Island Empire Technology Systems (IETS) – Capability Statement

Island Empire Technology Systems, LLC (IETS) is a Native Hawaiian Organization (NHO)-owned, SBA 8(a) certified small business delivering IT and professional services to federal agencies. With CMMI DEV & SVC L3, ISO 9001, 20000 & 27001 certifications, we ensure secure, efficient, and high-quality solutions.

Core Capabilities

IT & Business Consulting: Strategy, PMO, IV&V, CIO Advisory

Cybersecurity & Infrastructure: FISMA/NIST compliance, cyber defense, datacenter & enterprise ops

Digital Innovation: AI/ML, Data Analytics, Cloud, DevOps/DevSecOps, RPA, UI/UX, mobile solutions

Application Services: Custom development, COTS integration, BI, QA/testing

Training & Professional Services: Executive coaching, HR/staffing, records & admin support

Certifications: SBA 8(a), NHO, CMMI L3, ISO 9001/20000/27001
UEI: TGGAL8H2TRQ4 | CAGE: 8WD37 | NAICS: 541611, 541618, 541511, 541512, 541513, 541519, 611430",https://certifications.sba.gov/capabilities/TGGAL8H2TRQ4,8(a),ALEX HEIDT,Finance@digitalspec.net,747 MALUNIU AVE,,KAILUA,Hawaii,96734,541611,"334112, 513210, 518210, 541330, 541511, 541512, 541513, 541519, 541611, 541613, 541614, 541618, 541690, 541990, 561110, 561210, 561312, 561410, 561439, 611420, 611430","334112, 513210, 518210, 541330, 541511, 541512, 541513, 541519, 541611, 541613, 541614, 541618, 541690, 541990, 561110, 561210, 561312, 561410, 561439, 611420, 611430"
"=HYPERLINK( ""https://search.certifications.sba.gov/profile/R37EXBFX4WR3/03L35"", ""AHTNA USA-CDM JV"" )",,,8(a) JV,SKY SIEMERS,ssiemers@ahtna.net,3100 BEACON BLVD,,WEST SACRAMENTO,California,95691,237110,"221310, 236210, 236220, 237110, 237130, 237310, 237990, 238190, 238910, 541310, 541330, 562910","221310, 236210, 236220, 237110, 237130, 237310, 237990, 238190, 238910, 541310, 541330, 562910"
"=HYPERLINK( ""https://search.certifications.sba.gov/profile/YPABB25UK1L3/88Z51"", ""DELTA POINT LLC"" )","Delta Point LLC is a Federally recognized Alaska Native Village Corporation and Socio economic disadvantaged Small Business.  We specialize in project management, systems integration, staff augmentation and physical security infrastructure implementation.  Delta Point LLC has significant experience in management of complex projects and team building to bring the best of breed technologies and services to our Government Agency and Commercial customers.",,8(a),BRAXTON APPERSON,braxton.apperson@deltapointak.com,10633 WASHINGTON CIR,,ANCHORAGE,Alaska,99515,541513,"237130, 238210, 334220, 423450, 541511, 541512, 541513, 541519, 541611, 561612","237130, 238210, 334220, 423450, 541511, 541512, 541513, 541519, 541611, 561612"
"=HYPERLINK( ""https://search.certifications.sba.gov/profile/TKDXFAZUZ257/9HB47"", ""NORTH WIND GENERAL CONTRACTORS, LLC"" )","North Wind General Contractors, LLC (NWGC) is an 8(a) small disadvantaged business firm. As a General Contractor, NWGC provides comprehensive construction services for commercial and government customers at multiple project locations across the U.S. NWGC offers our clients a low risk small business backed by a mature, financially strong parent organization and an excellent past performance history. We competitively bid and manage both large stand-alone projects as well as multiple task order IDIQ contracts, including 100% design, design-build, demolition, facilities repair, fuels systems, and new construction. NWGC is part of a family of North Wind companies with common ownership under Cook Inlet Region, Inc. (CIRI), an Alaska Native Corporation (ANC). The North Wind family of companies is managed by North Wind Group, a CIRI government ANC contract holding entity.",,8(a),BRENT BROOKS,bbrooks@northwindgrp.com,2525 C ST STE 130,,ANCHORAGE,Alaska,99503,236210,"115310, 221310, 236210, 236220, 237110, 237120, 237130, 237310, 237990, 238110, 238160, 238210, 238220, 238910, 238990, 562910, 712120","115310, 221310, 236210, 236220, 237110, 237120, 237130, 237310, 237990, 238110, 238160, 238210, 238220, 238910, 238990, 562910, 712120"
"=HYPERLINK( ""https://search.certifications.sba.gov/profile/D9YJRBHZ42B5/9N2L6"", ""KWAAN ARES DEFENSE LLC"" )",,,8(a) JV,AARON TILOCK,aaron.tilock@kwaan.tech,5500 CHEROKEE AVE STE 100,,ALEXANDRIA,Virginia,22312,541519,"517111, 541330, 541519, 541611, 541618, 561210","517111, 541330, 541519, 541611, 541618, 561210"
"=HYPERLINK( ""https://search.certifications.sba.gov/profile/MQENNZXWLBA3/4ECU7"", ""J. BRENNON CONSTRUCTION, INC."" )","J Brennon Construction provides outstanding construction and project oversight. Our services begin with architectural surveys, architectural drawings, and continue through the entire construction process.",,8(a),"BRENNON SMITH, SR.",org@jbrennon.com,1419 CHATTANOOGA AVE,SUITE 4,DALTON,Georgia,30720,236210,"236210, 236220, 238110, 238120, 238130, 238190, 238310, 238320, 238330, 238340, 238350, 238390, 238910, 238990","236210, 236220, 238110, 238120, 238130, 238190, 238310, 238320, 238330, 238340, 238350, 238390, 238910, 238990"
"=HYPERLINK( ""https://search.certifications.sba.gov/profile/UNMLFNGA9WT9/6P7G0"", ""ASRC EARTHWORKS, LLC"" )","ASRC Earthworks is an 8(a)-certified business specializing in heavy civil construction, materials extraction, and paving projects for federal, state, and local government agencies. With expertise in aggregate processing and asphalt production, our team understands both routine and complex civil projects and the unique requirements of working on U.S. military installations. Our modern fleet is equipped to work in remote, logistically complex locations across Alaska, ensuring efficient project execution in challenging environments.","https://asrcconstruction.com/about/capabilities/  ",8(a),BRICE CONKLIN,bconklin@asrcconstruction.com,3900 C ST,STE 309,ANCHORAGE,Alaska,99503,237990,"212319, 212321, 236220, 237310, 237990, 562910","212319, 212321, 236220, 237310, 237990, 562910"
"=HYPERLINK( ""https://search.certifications.sba.gov/profile/GHLJX6LSQET8/69K56"", ""KATMAI INTEGRATED SOLUTIONS, LLC"" )","We provide engineering and maintenance services for the DoD with an emphasis on weapon systems and weapon-based training aids, devices, simulators, and simulations. We offer Contractor Logistics Support (CLS) and Contractor Operations and Maintenance Services (COMS), to include custom engineering and fabrication; simulator upgrade and replacement; form, fit, and functional equipment replacement; computer system replacement and software re-host; system installation and platform integration; preventative and corrective maintenance; obsolescence management; instructor/operator training; preventive and corrective maintenance; inventory management; and supply support.",https://katmaicorp.box.com/v/KIS-MTG-CAP-STMNT,8(a),TERESA DERRICKSON,The business owner has hidden this information from public searches,11001 OMALLEY CENTRE DR STE 204,,ANCHORAGE,Alaska,99515,541330,"236210, 236220, 237130, 238210, 334111, 493110, 518210, 541330, 541511, 541512, 541513, 541519, 541611, 541612, 541614, 541618, 541620, 541690, 541715, 541990, 561110, 561210, 561320, 561422, 561499, 561720, 611512, 611699, 611710, 621111, 621399, 622110","236210, 236220, 237130, 334111, 493110, 518210, 541330, 541511, 541512, 541513, 541519, 541612, 541715, 561210, 561320, 611512, 622110"
"=HYPERLINK( ""https://search.certifications.sba.gov/profile/MEMKB3JT64J8/5FWE8"", ""WISEFOX SOLUTIONS, INC."" )","Certified 8(a) SDB provides managed IT services, disaster recovery, structured cabling, network administration,enterprise networks, audio and video, and telephone systems. Owner operated for sixteen years.",,8(a),ERIC HUNT,eric.hunt@smartfox.us,426 MOULTON ST E,,DECATUR,Alabama,35601,541512,"236220, 238210, 335921, 541330, 541511, 541512, 541519, 541715","236220, 238210, 335921, 541330, 541511, 541512, 541519, 541715"
"=HYPERLINK( ""https://search.certifications.sba.gov/profile/NENSLR2C1VH9/8FBE7"", ""ASRC FEDERAL FACILITIES LOGISTICS LLC"" )","AFFL capabilities cover a broad range of services, inventory management, logistics, quality assurance, transportation of materials, administrative and technical disciplines as well as facility support services and facility operations and maintenance. Our principle assets are our people, procedures, and processes that have been developed as a result of our experience and expertise working in these areas. Our service offerings in this industry segment are focused on meeting the demand across the Federal Government for a wide range of Process, Physical Distribution and Logistics Consulting Services. Typical services include: Manufacturing operations improvement, Productivity improvement, Production planning and control, Quality assurance and quality control, Inventory management, Distribution networks, Warehouse use, operations, and utilization, Transportation and shipment of goods and materials; and Materials management and handling services.",,8(a),SCOTT SALZANO,Scott.Salzano@asrcfederal.com,7000 MUIRKIRK MEADOWS DR,STE 100,BELTSVILLE,Maryland,20705,541614,"332722, 333611, 333998, 334111, 493190, 517810, 541330, 541511, 541512, 541513, 541519, 541611, 541614, 541690, 541820, 541990, 561110, 561210, 561990, 611430","332722, 333611, 333998, 334111"
"=HYPERLINK( ""https://search.certifications.sba.gov/profile/TFAJG6K8D696/3HEP9"", ""L & L DRYWALL & CONSTRUCTION, INC."" )",L & L Drywall & Construction Inc. is a Commercial General Contractor for the state of North Carolina.,,8(a),DAVID LOCKLEAR,dl@lldrywall-construction.com,1617 GILLESPIE ST,,FAYETTEVILLE,North Carolina,28306,236220,"115310, 236118, 236210, 236220, 237310, 237990, 238110, 238120, 238130, 238140, 238160, 238170, 238190, 238210, 238220, 238290, 238310, 238320, 238330, 238350, 238390, 238910, 238990, 332311, 332312, 333120, 337215, 484210, 531110, 541320, 541330, 541611, 541620, 541690, 541990, 561210, 561730, 561790, 562910","115310, 236118, 236210, 236220, 237310, 237990, 238110, 238120, 238130, 238140, 238160, 238170, 238190, 238210, 238220, 238290, 238310, 238320, 238330, 238350, 238390, 238910, 238990, 332311, 332312, 333120, 337215, 484210, 531110, 541320, 541330, 541611, 541620, 541690, 541990, 561210, 561730, 561790, 562910"
"=HYPERLINK( ""https://search.certifications.sba.gov/profile/EC1JA2TNMHF6/8M7N9"", ""OJIBWE HAZARDOUS ABATEMENT, LLC"" )",,,"8(a), HUBZone",RACHEL HECKEL,rachel.heckel@sti-federal.com,531 ASHMUN ST,,SAULT SAINTE MARIE,Michigan,49783,562910,"236220, 237110, 237990, 238220, 238990, 334310, 512110, 517121, 517810, 541330, 541350, 541380, 541519, 541611, 541620, 541690, 541990, 562910, 623110","236220, 237110, 237990, 238220, 238990, 334310, 512110, 517121, 517810, 541330, 541350, 541380, 541519, 541611, 541620, 541690, 541990, 562910, 623110"
"=HYPERLINK( ""https://search.certifications.sba.gov/profile/M5LUG7KAKEJ4/7Z7B6"", ""BOWHEAD ENTERPRISE, SCIENCE AND TECHNOLOGY, LLC"" )","Our highly skilled technical professionals hold advanced engineering, technology, and science degrees. We prioritize continuous process improvements to deliver tailored solutions that meet our customers' diverse and evolving needs. We offer comprehensive services, including training and instruction, risk management, cybersecurity, and program support. Our Advisory and Assistance Services (A&AS) and engineering and technical services provide expert guidance and support. Our IT expertise includes performance tuning, system availability, capacity planning, provisioning, and security, with a strong emphasis on Security Tech Implementation Guides (STIG), Info Assurance Vulnerability Alerts (IAVA), and Info Assurance (IA) implementation and compliance. Our seasoned SMEs conduct Risk Management Framework (RMF) validations and complete system Assessment and Authorization (A&A) processes to establish Authority to Operate (ATO). Holds Top Secret security clearance.",https://www.bowhead.com/companies/bowhead-enterprise-science-and-technology/,8(a),LORI SCHENDEL,lori.schendel@bowheadsupport.com,6564 LOISDALE CT STE 900,,SPRINGFIELD,Virginia,22150,811210,"334111, 512191, 513210, 517810, 518210, 541219, 541330, 541410, 541430, 541512, 541513, 541519, 541611, 541614, 541618, 541620, 541690, 541715, 541810, 541820, 541990, 561110, 561621, 561990, 611310, 611430, 611512, 621511, 621999, 811111, 811210","334111, 512191, 513210, 517810, 518210, 541219, 541330, 541512, 541513, 541519, 541611, 541614, 541618, 541620, 541690, 541715, 541810, 541820, 541990, 561110, 561621, 561990, 611310, 611430, 611512, 621511, 621999, 811210"
"=HYPERLINK( ""https://search.certifications.sba.gov/profile/ZAHMVDVNFRN5/94F62"", ""CHITINA DIVERSIFIED SERVICES, LLC"" )","Chitina Diversified Services, LLC provides operations support with focus on seamless integration of Const Mgmt., Professional Services, staffing, employment services, personnel administration and program management.",,8(a),ED HERNDON,eherndon@chitinadiversified.com,"7401 S BITTERROOT PL, STE 203",,SIOUX FALLS,South Dakota,57108,236220,"221112, 236118, 236210, 236220, 237310, 237990, 238110, 238190, 238210, 238910, 238990, 531110, 541330, 541490, 541511, 541512, 541513, 541519, 541611, 541612, 541613, 541614, 541690, 541990, 561110, 561210, 561320, 561499, 561720, 561730, 561990, 611430, 811210","221112, 236118, 236210, 236220, 237310, 237990, 238110, 238190, 238210, 238910, 238990, 531110, 541330, 541490, 541511, 541512, 541513, 541519, 541611, 541612, 541613, 541614, 541690, 541990, 561110, 561210, 561320, 561499, 561720, 561730, 561990, 611430, 811210"
"=HYPERLINK( ""https://search.certifications.sba.gov/profile/CJVTHHL129F3/9CPW1"", ""LEISNOI ENTERPRISE SOLUTIONS LLC"" )",,,8(a),ROBERT MILLER,The business owner has hidden this information from public searches,The business owner has hidden this information from public searches,The business owner has hidden this information from public searches,The business owner has hidden this information from public searches,The business owner has hidden this information from public searches,The business owner has hidden this information from public searches,541519,"518210, 541511, 541513, 541519, 561110","518210, 541511, 541513, 541519, 561110"
"=HYPERLINK( ""https://search.certifications.sba.gov/profile/L32HMCJ3SVL9/49WJ8"", ""PROTO TECHNOLOGIES, INC."" )","Rapid Prototyping, Additive Manufacturing, 3D Printing, silicone moldidng, Silicone casting Urethanes Castings, CNC Mill Machining, CNC Lathe Machining, Painting, Thermoforming.",,8(a),MONTE LARSEN,mlarsen@prototech.com,22808 E APPLEWAY AVE,,LIBERTY LAKE,Washington,99019,332710,"325991, 326199, 332710, 332721, 332999, 333511, 336411, 336412, 336413, 336415, 336419, 336992, 339999","325991, 326199, 332710, 332721, 332999, 333511, 336411, 336412, 336413, 336415, 336419, 336992, 339999"
"=HYPERLINK( ""https://search.certifications.sba.gov/profile/N14DPDAU18H4/91MW8"", ""LEISNOI PROFESSIONAL SERVICES, LLC"" )",,,"8(a), HUBZone",TAMIE TAYLOR,ttaylor@leisnoi.com,101 W BENSON BLVD STE 202,,ANCHORAGE,Alaska,99503,238220,"236220, 237110, 237310, 237990, 238110, 238210, 238220, 334118, 541511, 541512, 541513, 541519, 541618, 541690, 541990, 621498","236220, 237110, 237310, 237990, 238110, 238210, 238220, 334118, 541511, 541512, 541513, 541519, 541618, 541690, 541990, 621498"
"=HYPERLINK( ""https://search.certifications.sba.gov/profile/H8MDYH5MKMM9/8FXG5"", ""KOMAN INTEGRATED SOLUTIONS, LLC"" )","KIS, an 8(a) general contractor and wholly owned subsidiary of the Natives of Kodiak, Inc. (NOK)—an Alaska Native Corporation (ANC)—is dedicated to safely building quality projects while consistently exceeding client expectations. As part of the KOMAN family of companies, we offer a “one-stop shop” for a wide range of services. KIS specializes in general contracting, electrical distribution, new pavement installation, pavement preservation and maintenance, airfield paving (concrete and asphalt), underground construction, earthwork and excavation, demolition, abatement, concrete work (both major and minor), and wet and dry utility services. We have a proven track record of success delivering high-quality outcomes in design-build projects, vertical and horizontal new construction, remodels and expansions, repairs and maintenance, construction support, and full-spectrum general construction services.",https://komanholdings.com/wp-content/uploads/2024/09/KIS-Capabilities-Statement_2024.09_24.pdf,8(a),RUSSELL BORMAN,rborman@komanintsol.com,5632 N 54TH AVE,,GLENDALE,Arizona,85301,237130,"221121, 221122, 221310, 236115, 236210, 236220, 237110, 237130, 237310, 237990, 238110, 238290, 238910, 541611, 562910","221121, 221122, 221310, 236115, 236210, 236220, 237110, 237130, 237310, 237990, 238110, 238290, 238910, 541611, 562910"
"=HYPERLINK( ""https://search.certifications.sba.gov/profile/KTX5W6E1E8E1/7Y2F3"", ""BRISTOL ENVIRONMENTAL SOLUTIONS LLC"" )","Remediation and clean up of contaminated buildings, mines, sites, soil, and ground water, mine reclamation, demolition, waste/water treatment, hazardous material removal, land contouring, revegetation, asbestos abatement, lead paint/abatement, toxic material abatement, vertical/horizontal construction, environmental remediation, civil/structural engineering, fuel systems, fuels, fuel systems construction and maintenance, munitions response and site investigation, Munitions and Explosives, MEC, Unexploded Ordnance, UXO",,8(a),ANDY BIAGGI,sam-registration@bristol-companies.com,111 W 16TH AVE,STE 300,ANCHORAGE,Alaska,99501,562910,"237990, 541620, 562910, 624230","237990, 541620, 562910, 624230"
"=HYPERLINK( ""https://search.certifications.sba.gov/profile/G6WGYB8SKE53/7RBD3"", ""TEKPRO SUPPORT SERVICES, LLC"" )","TekPro Support Services, LLC provides document preparation services to include document editing and proofreading, word processing and desktop publishing and other administrative support services.",,8(a),REGINA MONROE,Regina.Monroe@tekprosupport.com,1826 N LOOP 1604 W STE 336C,,SAN ANTONIO,Texas,78248,541611,"491110, 492210, 513199, 516210, 518210, 519290, 541211, 541214, 541219, 541330, 541519, 541611, 541612, 541613, 541614, 541618, 541620, 541690, 541715, 541720, 541810, 541990, 561110, 561210, 561311, 561320, 561410, 561431, 561499, 561611, 621111, 621999","492210, 513199, 516210, 518210, 519290, 541214, 541330, 541519, 541612, 541715, 541720, 561210, 561311, 561320"
