Business name,Capabilities narrative,Capabilities statement link,Active SBA certifications,Contact person's name,Contact person's email,Address line 1,Address line 2,City,State,Zipcode,Primary NAICS code,All NAICS codes,“Small” NAICS codes
"=HYPERLINK( ""https://search.certifications.sba.gov/profile/VKDUSM2MJEQ3/46PT2"", ""ADESCO, LLC"" )","non-explosive demolition, debris removal, excavation,
septic install and removal, site cleanup and prep,
oil spill cleanup, water land cargo transport,",,"8(a), HUBZone, VOSB",RANDOLPH ZIMIN,Randy@adescoak.com,1963 WILD THING WAY,,SOUTH NAKNEK,Alaska,99670,483113,"212321, 236210, 236220, 237310, 237990, 238910, 238990, 423930, 481211, 481212, 481219, 483111, 483113, 483211, 488190, 488390, 493110, 493190, 532411, 541214, 541219, 541620, 561110, 561210, 561410, 561499, 624230","212321, 236210, 236220, 237310, 237990, 238910, 238990, 423930, 481211, 481212, 481219, 483111, 483113, 483211, 488190, 488390, 493110, 493190, 532411, 541214, 541219, 541620, 561110, 561210, 561410, 561499, 624230"
"=HYPERLINK( ""https://search.certifications.sba.gov/profile/ZMXTVJK1B4S7/9DHY7"", ""ALEUT GOVERNMENT SERVICES LLC"" )",,,8(a),ROBERT CAVINESS,robert.caviness@aleutfederal.com,5775 MARK DABLING BLVD.,"STE 105, OFFICE 116",COLORADO SPRINGS,Colorado,80919,561720,"532420, 541611, 561720","532420, 541611, 561720"
"=HYPERLINK( ""https://search.certifications.sba.gov/profile/Z1XNFH26E232/92R35"", ""ONEIDA PROFESSIONAL SERVICES LLC"" )",,,8(a),CYNTHIA SHAW,cshaw@oescgroup.com,1033 N MAYFAIR RD STE 200,,MILWAUKEE,Wisconsin,53226,541990,"517111, 517810, 541330, 541511, 541512, 541513, 541519, 541611, 541614, 541618, 541690, 541715, 541990, 561110, 561210, 561320, 561410, 611310, 611420, 611430, 611512, 611519, 611691, 611699, 611710, 621399, 811310","517111, 517810, 541330, 541511, 541512, 541513, 541519, 541611, 541614, 541618, 541690, 541715, 541990, 561110, 561210, 561320, 561410, 611310, 611420, 611430, 611512, 611519, 611691, 611699, 611710, 621399, 811310"
"=HYPERLINK( ""https://search.certifications.sba.gov/profile/U8RGX1HDELM7/8LF17"", ""CHUGACH INTELLIGENCE SOLUTIONS, LLC"" )","CISL utilizes our multiple decades of successful past performance within Chugach Alaska Corporation's organization to create teaming partnerships to CONUS and OCONUS sites. Location is not an issue where security clearances are required. CISL provides staff who can perform in any climate no matter how remote. CISL focuses on Facility Support Services specializing in Facilities Operations, Maintenance Support, QA/QC, Warehouse, Janitorial, Guards and Security, and minor Construction.

Chugach focuses on efficiencies and innovative solutions, allowing us to develop creative and best -in-class approaches to support our customers' evolving needs.",https://certifications.sba.gov/capabilities/U8RGX1HDELM7,8(a),WILLIAM BYRUM,William.Byrum@chugachgov.com,3800 CENTERPOINT DR STE 1200,,ANCHORAGE,Alaska,99503,561210,"236220, 237990, 238210, 238220, 238910, 332311, 334220, 334310, 334419, 334519, 335999, 493110, 493190, 541330, 541511, 541512, 541513, 541519, 541611, 541614, 541618, 541690, 541715, 561110, 561210, 561320, 561621, 561720, 561730, 561990, 562111, 562119","236220, 237990, 332311, 334220, 334310, 334419, 334519, 335999, 541330, 541715, 561210, 562111, 562119"
"=HYPERLINK( ""https://search.certifications.sba.gov/profile/NFUEF8YFSN59/6UEC4"", ""INFORMATION TECHNOLOGY SOLUTIONS CORP"" )","Information Technology Solutions (ITS) is an SBA certified 8(a) company dedicated to providing complete IT and Electrical solutions for our clients. ITS focuses on Chief Technology Officer (CTO) and Project Management Consulting, as well as Help Desk Support services.",,8(a),RYAN LEE,ryan@itsolutionsco.com,336 MAIN ST STE 202,,GRAND JUNCTION,Colorado,81501,541512,"238210, 541511, 541512, 541513, 541519, 561210, 561621, 561990","238210, 541511, 541512, 541513, 541519, 561210, 561621, 561990"
"=HYPERLINK( ""https://search.certifications.sba.gov/profile/NENSLR2C1VH9/9RSC1"", ""ASRC FEDERAL FACILITIES LOGISTICS LLC"" )","AFFL capabilities cover a broad range of services, inventory management, logistics, quality assurance, transportation of materials, administrative and technical disciplines as well as facility support services and facility operations and maintenance. Our principle assets are our people, procedures, and processes that have been developed as a result of our experience and expertise working in these areas. Our service offerings in this industry segment are focused on meeting the demand across the Federal Government for a wide range of Process, Physical Distribution and Logistics Consulting Services. Typical services include: Manufacturing operations improvement, Productivity improvement, Production planning and control, Quality assurance and quality control, Inventory management, Distribution networks, Warehouse use, operations, and utilization, Transportation and shipment of goods and materials; and Materials management and handling services.",,8(a),SCOTT SALZANO,Scott.Salzano@asrcfederal.com,7000 MUIRKIRK MEADOWS DR,STE 100,BELTSVILLE,Maryland,20705,541614,"332722, 333611, 333998, 334111, 493190, 517810, 541330, 541511, 541512, 541513, 541519, 541611, 541614, 541690, 541820, 541990, 561110, 561210, 561990, 611430","332722, 333611, 333998, 334111"
"=HYPERLINK( ""https://search.certifications.sba.gov/profile/ZSLYKSHDBAV7/9RAT5"", ""SENECA INNOVATIONS, LLC"" )",,,8(a),ISABELLE WILLIAMS,iwilliams@senecaholdings.com,14200 PARK MEADOW DR STE 125-N,,CHANTILLY,Virginia,20151,541715,"334511, 423440, 488111, 488119, 488190, 488999, 518210, 541330, 541370, 541511, 541512, 541519, 541611, 541690, 541715, 541990","334511, 423440, 488111, 488119, 488190, 488999, 518210, 541330, 541370, 541511, 541512, 541519, 541611, 541690, 541715, 541990"
"=HYPERLINK( ""https://search.certifications.sba.gov/profile/S27MR5ZPZDD7/8FR29"", ""NIPOA STANDARD LLC"" )","Nipoa Standard LLC is a Native Hawaiian Organization (NHO) owned 8(a) company with extensive federal contracting experience. Our capabilities excel in real estate asset management services, administrative and general management services, facilities support services, property and facility management services, construction management, building design and construction, specialized security solutions, waste and resource management program administration and engineering services.",https://nipoagroup.com,8(a),MARY MORIARTY,mmoriarty@nipoagroup.com,6270 KAUHOLA PL,,HONOLULU,Hawaii,96825,561210,"236116, 236210, 236220, 237210, 238160, 238310, 238990, 531311, 531312, 531320, 531390, 541191, 541330, 541611, 541618, 561210, 561499, 561790, 561990, 562111, 562910, 562998","236116, 236210, 236220, 237210, 238160, 238310, 238990, 531311, 531312, 531320, 531390, 541191, 541330, 541611, 541618, 561210, 561499, 561790, 561990, 562111, 562910, 562998"
"=HYPERLINK( ""https://search.certifications.sba.gov/profile/QQ34JXBWECB7/9PJE1"", ""CREEK CONNECTIONS LLC"" )",,,8(a) JV,RICHARD WILLIAMS,Richard@fusiononline.com,4951 CENTURY ST NW,,HUNTSVILLE,Alabama,35816,541810,"512110, 541430, 541511, 541512, 541613, 541810, 541820, 541840, 541990","512110, 541430, 541511, 541512, 541613, 541810, 541820, 541840, 541990"
"=HYPERLINK( ""https://search.certifications.sba.gov/profile/DYTWPFDSNVB5/8VXR8"", ""RECONCRAFT, LLC"" )",,,8(a),JONATHAN HOFLICH,jon.hoflich@reconcraft.com,9891 SE MATHER RD,,CLACKAMAS,Oregon,97015,336612,336612,336612
"=HYPERLINK( ""https://search.certifications.sba.gov/profile/QVE4KUVM3XS1/9T4F3"", ""EASTERN SHAWNEE PROFESSIONAL SERVICES, LLC"" )","Eastern Shawnee Professional Services, LLC (ESPS), proudly owned by the Eastern Shawnee Tribe of Oklahoma (ESTO), specializes in accelerated contracting and innovative solutions tailored to the specific needs of federal government and private industry clients. Leveraging extensive experience and a commitment to superior service and value, we ensure the success of every project we undertake. As a tribally owned enterprise, ESPS benefits from unique federal procurement opportunities, allowing us to streamline contract processes for enhanced project timelines and budget efficiency. Core capabilities include Information Technology, providing Technology and security audits, managed IT services and staffing; Audiovisual solutions including design, procurement, installation, maintenance and support services; Geospatial solutions; Environmental planning, remediation and consulting services; Staffing and recruiting, administrative support services and program management.",https://easternshawneecompanies.com/wp-content/uploads/2025/04/2025-ESPS-Capability-Statement_Professional-Services.pdf,8(a),JUDY REAGAN,judy.reagan@easternshawneecompanies.com,6400 GLENWOOD ST STE 320,,MISSION,Kansas,66202,541990,"115310, 236220, 238210, 311999, 334310, 512110, 518210, 519210, 519290, 532420, 541310, 541320, 541330, 541340, 541350, 541360, 541370, 541380, 541410, 541420, 541430, 541490, 541511, 541512, 541513, 541519, 541611, 541612, 541613, 541618, 541620, 541690, 541713, 541720, 541922, 541990, 561110, 561210, 561311, 561312, 561320, 561499, 561621, 562112, 562910, 611420, 611430, 712110, 712120","115310, 236220, 238210, 311999, 334310, 512110, 518210, 519210, 519290, 532420, 541310, 541320, 541330, 541340, 541350, 541360, 541370, 541380, 541410, 541420, 541430, 541490, 541511, 541512, 541513, 541519, 541611, 541612, 541613, 541618, 541620, 541690, 541713, 541720, 541922, 541990, 561110, 561210, 561311, 561312, 561320, 561499, 561621, 562112, 562910, 611420, 611430, 712110, 712120"
"=HYPERLINK( ""https://search.certifications.sba.gov/profile/JEB2QWXLEER5/7PYS1"", ""LEISNOI PROFESSIONAL SERVICES LLC"" )","Leisnoi Professional Services (LPS) is an Alaska Native Owned Corporation (ANC).  is SBA HUBZone and 8(a)Certified.  The LPS offers a wide range of professional, administrative and support services, including Enterprise Solutions, Personnel & Program Management,  Facility Management and Marine & Environmental Services",https://leisnoi.com/,"8(a), HUBZone",TAMIE TAYLOR,ttaylor@leisnoi.com,194 ALIMAQ DR # 216,,KODIAK,Alaska,99615,238220,"236220, 237110, 237310, 237990, 238110, 238210, 238220, 238320, 238990, 334118, 541199, 541511, 541512, 541513, 541519, 541611, 541618, 541690, 541990, 561110, 561210, 561612, 562910, 621498","236220, 237110, 237310, 237990, 238110, 238210, 238220, 238320, 238990, 334118, 541199, 541511, 541512, 541513, 541519, 541611, 541618, 541690, 541990, 561110, 561210, 561612, 562910, 621498"
"=HYPERLINK( ""https://search.certifications.sba.gov/profile/LDGXZKU1HG27/9W3J7"", ""AVFEDERAL TECH SOLUTIONS, LLC"" )",,,8(a) JV,FIRMADGE CRUTCHFIELD,fcrutchfield@atisolutions.us,47 E SOUTH ST UNIT 002,,FREDERICK,Maryland,21701,541519,"518210, 541511, 541512, 541513, 541519, 541990","518210, 541511, 541512, 541513, 541519, 541990"
"=HYPERLINK( ""https://search.certifications.sba.gov/profile/WKX5XUQGH276/93NA9"", ""KATMAI PROFESSIONAL SERVICES, LLC"" )","We perform a wide range of functions including professional, administrative, management, and technical support services. Our capabilities cover information technology services, software engineering, and software development. Additionally, we conduct research and development, provide legal and administrative support, and offer scientific, communication, management, policy, and analytical support services. Beyond these, we also deliver other essential business support services such as logistics support, warehousing, mailroom delivery and management, inventory management, facilities business support, and conference and logistics planning.",https://katmaicorp.box.com/v/KPS-MTG-CAP-STMNT,8(a),TERESA DERRICKSON,The business owner has hidden this information from public searches,11001 O'MALLEY CENTRE DRIVE,SUITE 204,ANCHORAGE,Alaska,99515,561499,"491110, 541199, 541330, 541512, 541513, 541611, 541620, 541840, 541990, 561110, 561210, 561499, 561920, 611430, 624190","491110, 541199, 541330, 541512, 541513, 541611, 541620, 541840, 541990, 561110, 561210, 561499, 561920, 611430, 624190"
"=HYPERLINK( ""https://search.certifications.sba.gov/profile/L6NXD48QG5M1/04JV2"", ""ALTITUDE TECHNOLOGIES INC."" )","Altitude Technologies, Inc. dba Chinook Medical Gear is a certified HUBZone, Veteran-Owned and Small Disadvantaged Business 8(a) (Native American) Owned business that provides custom medical solutions for the harshest environments. Since 1990, Chinook Medical Gear has specialized in outfitting government agencies, military units, contractors, corporations, adventure companies, and individuals with the latest medical gear. Our diverse line of products includes military and law enforcement medical kits to home, travel, and public access medical kits. We also produce a wide range of procedure specific medical modules. Chinook’s staff consists of industry experts who specialize in designing trusted solutions for any emergency medical need. 

OUR MISSION: Chinook Medical Gear exists to deliver custom medical solutions for pre-hospital care, enabling medical providers to save lives and aid the injured.",https://www.chinookmed.com/cms/capabilities/capabilities/1.html,"8(a), HUBZone, VOSB",WILLIAM CROWDER,ben@chinookmed.com,12505 E 55TH ST,UNIT B,TULSA,Oklahoma,74146,423450,"325412, 325612, 326299, 332216, 332999, 333310, 334510, 334516, 339112, 339113, 339114, 339999, 423450, 423460, 423490, 423610, 423910, 423990, 424210, 424920, 424990, 561910, 611519, 611699","325412, 325612, 326299, 332216, 332999, 333310, 334510, 334516, 339112, 339113, 339114, 339999, 423450, 423460, 423490, 423610, 423910, 423990, 424210, 424920, 424990, 561910, 611519"
"=HYPERLINK( ""https://search.certifications.sba.gov/profile/C1EGE2USD1J6/85A67"", ""SES INFRASTRUCTURE SERVICES LLC"" )",,,8(a),JOHN MORRISON,dmorrison@bbch-llc.com,10815 GULFDALE ST,STE 6,SAN ANTONIO,Texas,78216,238320,"213112, 236210, 236220, 237120, 237310, 237990, 238320, 541620, 561210, 562910","213112, 236210, 236220, 237120, 237310, 237990, 238320, 541620, 561210, 562910"
"=HYPERLINK( ""https://search.certifications.sba.gov/profile/MY6BNHZX9SQ5/9WHT8"", ""KOMAN ENVIRONMENTAL ASSESSMENT SERVICES, LLC"" )",,https://komanholdings.com/wp-content/uploads/2025/01/Capabilities-Flyer_KEAS_2025.01.pdf,8(a),ERIC MCLAURIN,emclaurin@komanholdings.com,2700 GAMBELL ST STE 401,,ANCHORAGE,Alaska,99503,541620,"115112, 541330, 541519, 541620, 541990, 562910","115112, 541330, 541519, 541620, 541990, 562910"
"=HYPERLINK( ""https://search.certifications.sba.gov/profile/RDJCMHPH6EU8/54A03"", ""LCG, INC."" )","LCG is a small business, construction, facilities maintenance and forestry prime contractor for US government agencies as well as private industry.",https://www.landcongroup.com,"8(a), VOSB",TOM MORTON,tom@landcongroup.com,202 N 9TH ST STE 205A,,BOISE,Idaho,83702,238990,"115310, 236115, 236220, 237110, 237130, 237310, 237990, 238140, 238150, 238190, 238220, 238290, 238310, 238320, 238910, 238990, 532120, 532310, 541614, 561210, 561720, 561730, 561790, 562910, 562991","115310, 236115, 236220, 237110, 237130, 237310, 237990, 238140, 238150, 238190, 238220, 238290, 238310, 238320, 238910, 238990, 532120, 532310, 541614, 561210, 561720, 561730, 561790, 562910, 562991"
"=HYPERLINK( ""https://search.certifications.sba.gov/profile/DSYAAUREKE81/9JUV7"", ""DDC SUMMIT JV, LLC"" )",,,8(a) JV,SCOTT MCKEE,scott.mckee@dine-source.com,8840 E CHAPARRAL RD STE 145,,SCOTTSDALE,Arizona,85250,541330,"541330, 541519","541330, 541519"
"=HYPERLINK( ""https://search.certifications.sba.gov/profile/ENWEMNJABJB3/8E3Q3"", ""PCI GOVERNMENT SERVICES LLC"" )",,,8(a),JOYCE AYRES,jayres@pcifederal.com,12007 SUNRISE VALLEY DR STE 400,,RESTON,Virginia,20191,541618,"518210, 522292, 522310, 522320, 522390, 523150, 541219, 541330, 541511, 541512, 541513, 541519, 541611, 541618, 541620, 541690, 541820, 541910, 541990, 561110, 561422, 562910","518210, 522292, 522320, 522390, 523150, 541330, 541511, 541512, 541513, 541519, 562910"
"=HYPERLINK( ""https://search.certifications.sba.gov/profile/X61FEJ4C1SJ8/0Q8N2"", ""YAKA SOLUTIONS, LLC"" )",,,8(a) JV,,The business owner has hidden this information from public searches,The business owner has hidden this information from public searches,The business owner has hidden this information from public searches,The business owner has hidden this information from public searches,The business owner has hidden this information from public searches,The business owner has hidden this information from public searches,,,
"=HYPERLINK( ""https://search.certifications.sba.gov/profile/HKEXMP55KEG6/686W3"", ""BGESH INCORPORATED"" )","Bgesh is a small business which provides professional and technical services across various industries. Since 2010, Bgesh has supported over 250 federal, DoD, and commercial clients. We've heavily focused our capability to support our clients’ missions. For us that means we emphasize our strong program management and recruiting teams which allow us to provide a wide range of services and solutions beyond those core capabilities to include financial management, information technology, cybersecurity, healthcare staffing, physical security consulting, and construction. Bgesh’s team of industry professionals includes accomplished Program, Project, and Technical Managers that have an average of 22 years industry experience. We are a financially stable small business whose centralized headquarters in San Antonio, Texas and regional operations nationwide, allow us to quickly mobilize resources to any project site and thereby serve our clients' mission requirements across all geographies.",https://certify.sba.gov/capabilities/HKEXMP55KEG6,"8(a), WOSB, EDWOSB",WESTON HALLIBURTON,whalliburton@bgesh.com,21943 DIAMOND CHASE STE 200,,SAN ANTONIO,Texas,78259,561320,"113210, 115116, 115210, 115310, 236220, 237110, 237120, 237130, 238120, 238190, 238210, 238290, 332311, 334118, 339112, 339113, 423430, 493110, 532420, 532490, 541199, 541214, 541219, 541320, 541330, 541380, 541511, 541512, 541513, 541519, 541611, 541612, 541613, 541614, 541618, 541620, 541690, 541715, 541850, 541930, 541990, 561110, 561210, 561311, 561312, 561320, 561410, 561611, 561612, 561621, 561720, 561730, 561790, 562910, 611430, 621399, 621498, 621999, 622110, 711510, 722310, 811310","113210, 115116, 115210, 115310, 236220, 237110, 237120, 237130, 238120, 238190, 238210, 238290, 332311, 334118, 339112, 339113, 423430, 493110, 532420, 532490, 541199, 541214, 541219, 541320, 541330, 541380, 541511, 541512, 541513, 541519, 541611, 541612, 541613, 541614, 541618, 541620, 541690, 541715, 541850, 541930, 541990, 561110, 561210, 561311, 561312, 561320, 561410, 561611, 561612, 561621, 561720, 561730, 561790, 562910, 611430, 621399, 621498, 621999, 622110, 711510, 722310, 811310"
"=HYPERLINK( ""https://search.certifications.sba.gov/profile/P3XLXMKQMLT7/97XP8"", ""NOOMA CONSTRUCTION LLC"" )","Centrally located between Oklahoma City and Lawton-Ft. Sill, NooMa Construction, LLC primarily works in the field of poured and finished concrete foundations and structures. NooMa also has experience in general contracting and has completed work for public/commercial, private/residential, tribal, and federal entities. NooMa Construction, LLC has been family-owned and operated since its founding in 2016. NooMa is SBA 8(a) Certified, Economically Disadvantaged Woman-Owned (EDWOSB), Native American Owned, and NMSDC Minority Business Enterprise owned and operated by Comanche Nation citizen, Sunny Hegwood.",,"8(a), WOSB, EDWOSB",SUNNY HEGWOOD,sunny.hegwood@noomaconstruction.com,14660 NE 225TH ST,,FLETCHER,Oklahoma,73541,238110,"236220, 237310, 238110, 238160, 238910, 238990","236220, 237310, 238110, 238160, 238910, 238990"
"=HYPERLINK( ""https://search.certifications.sba.gov/profile/D6ZYKXJGMV35/9NLM7"", ""CHICKASAW FUTREND TECHNOLOGIES ALLIANCE, LLC"" )",,,8(a) JV,SHEILA HAMLIN,sheila.hamlin@chickasaw.com,2600 JOHN SAXON BLVD STE 2227,,NORMAN,Oklahoma,73071,541690,541690,541690
"=HYPERLINK( ""https://search.certifications.sba.gov/profile/FGEUDMN52X98/9MJY7"", ""BEAR MOUNTAIN SERVICES COMPANY"" )","Bear Mountain Services Company (BMSC), part of All Native Group and the Winnebago Tribe of Nebraska's economic development arm, is a top-secret cleared IT provider supporting federal agencies. We offer expertise in Microsoft 365, Azure, cloud services, RMF cybersecurity, network modernization, app development, IT support, RPA, and workflow optimization. BMSC ensures secure, scalable, and compliant IT solutions that drive federal mission success.",https://www.allnativegroup.com/wp-content/uploads/2025/09/ANG-Bear-Mountain-Services-Company.pdf,8(a),JANICE DEARMAN,jdearman@hochunkcorporateservices.com,818 ST AUGUSTINES DR,,WINNEBAGO,Nebraska,68071,541614,"334111, 334210, 334290, 334310, 334419, 334512, 335999, 336419, 339999, 423430, 423690, 493110, 493190, 517111, 517112, 517810, 518210, 541330, 541370, 541420, 541430, 541513, 541519, 541611, 541612, 541614, 541618, 541620, 541690, 541713, 541714, 541715, 541990, 561110, 561210, 561320, 561499, 561621, 561990, 611420, 611430, 711310, 722310","334111, 334210, 334290, 334310, 334419, 334512, 335999, 336419, 339999, 423430, 423690, 493110, 493190, 517111, 517112, 517810, 518210, 541330, 541370, 541420, 541430, 541513, 541519, 541611, 541612, 541614, 541618, 541620, 541690, 541713, 541714, 541715, 541990, 561110, 561210, 561320, 561499, 561621, 561990, 611420, 611430, 711310, 722310"
"=HYPERLINK( ""https://search.certifications.sba.gov/profile/J6XWV4TYFMJ4/8EJL0"", ""PUYENPA TECHNOLOGIES, LLC"" )","Puyenpa Technologies, LLC is an SBA certified Tribal 8(a) and HUBZone contractor founded in 2019. It is headquartered in Duckwater, Nevada with regional offices strategically located throughout the U.S., and the National Capital Region (NCR). As a Duckwater Shoshone Tribal Organization we are built on the foundation of expertise, professionalism & experience. Puyenpa is dedicated to providing a diverse range of IT Solutions, Program Management, Administrative support, Comms, Audio Visual, Physical Security & General Construction services for both the Federal Government and Commercial Sector. We are committed to delivering high-impact services and unwavering support, ensuring the delivery of top-quality results. We are a Capability Maturity Model Integration (CMMI) for Services (CMMI-SVC) Level 3, and a CMMI-Software Development (CMMI-DEV) Level 3, certified company. Puyenpa also holds ISO 9001:2015, ISO 20000, and ISO 27001:2013 for Quality & Information Security Management",https://www.puyenpa.com/puyenpa-technologies-llc,"8(a), HUBZone",EMILY STOUT,emilystout@puyenpa.com,511 DUCKWATER FALLS ROAD,,DUCKWATER,Nevada,89314,517111,"236220, 238210, 315990, 332999, 334118, 334220, 334310, 517111, 517121, 517810, 518210, 541310, 541330, 541420, 541430, 541511, 541512, 541513, 541519, 541611, 541614, 541618, 541690, 541930, 541990, 561110, 561210, 561320, 561330, 561612, 561621, 561622, 561790, 562910, 624190, 811210, 811310","236220, 238210, 315990, 332999, 334118, 334220, 334310, 517111, 517121, 517810, 518210, 541310, 541330, 541420, 541430, 541511, 541512, 541513, 541519, 541611, 541614, 541618, 541690, 541930, 541990, 561110, 561210, 561320, 561330, 561612, 561621, 561622, 561790, 562910, 624190, 811210, 811310"
"=HYPERLINK( ""https://search.certifications.sba.gov/profile/MUUPQKLPUD68/8JY35"", ""BROADLEAF SERVICES, INC."" )","Broadleaf Services is dedicated to helping government agencies achieve their goals through innovative IT solutions. The company offers cloud computing, cybersecurity, data analytics, and artificial intelligence services, enabling clients to modernize operations, improve security, and gain actionable insights. Our approach uses Agile methodologies, ensuring flexibility and responsiveness to client needs.
Broadleaf specializes in managing Microsoft systems, modernizing legacy applications, and supporting large-scale IT environments. We have extensive experience with federal clients like the DoD, where they’ve provided cybersecurity, cloud management, and advanced analytics. Additionally, Broadleaf has successfully transitioned and staffed projects requiring security clearances, ensuring smooth operations for sensitive missions.
Our work aligns with strict government standards, including compliance with DoD cybersecurity policies and data protection regulations.",https://certify.sba.gov/capabilities/MUUPQKLPUD68,8(a),JIM SNARE,jsnare@broadleaf-services.com,9720 CAPITAL CT STE 201,,MANASSAS,Virginia,20110,541513,"238220, 518210, 541330, 541511, 541512, 541513, 541519, 541611, 541618, 541990, 561110, 561210, 561320, 611420, 611430, 611710","238220, 518210, 541330, 541511, 541512, 541513, 541519, 541611, 541618, 541990, 561110, 561210, 561320, 611420, 611430, 611710"
"=HYPERLINK( ""https://search.certifications.sba.gov/profile/LL27JGJWEKC5/87GX1"", ""GREGG DRILLING, LLC"" )",,,8(a),TIM BOYD,tboyd@greggdrilling.com,2726 WALNUT AVE,,SIGNAL HILL,California,90755,237110,"237110, 237990, 238910, 562119, 562910","237110, 237990, 562119, 562910"
